{
  "recipes": [
    {
      "slug": "aetius-kyphi-28",
      "label": "Cyphi ex rebus XXVIII",
      "language": "la",
      "source": "Aetius of Amida, Liber XIII, Cap. CXVII (Cornarius & da Monte 1533), pp. 412-413; https://www.digitale-sammlungen.de/de/view/bsb00029105?page=424,425"
    }
  ],
  "ingredients": [
    { "slug": "aspalathos", "label": "aspalathi", "language": "la" },
    { "slug": "bdellium", "label": "bdellii", "language": "la" },
    { "slug": "elecampane", "label": "helenii", "language": "la" },
    { "slug": "ladanum", "label": "ladani", "language": "la" },
    { "slug": "storax", "label": "styracis", "language": "la" },
    { "slug": "myrrh", "label": "myrrhae", "language": "la" },
    { "slug": "juniper-berries", "label": "baccarum iuniperi", "language": "la" },
    { "slug": "royal-reed-extract", "label": "succi hastulae regiae", "language": "la" },
    { "slug": "savin", "label": "sabinae", "language": "la" },
    { "slug": "saffron", "label": "croci", "language": "la" },
    { "slug": "costus", "label": "costi", "language": "la" },
    { "slug": "cardamom", "label": "cardamomi", "language": "la" },
    { "slug": "cyperus", "label": "cyperorum", "language": "la" },
    { "slug": "cypress-seed", "label": "seminis cupressi", "language": "la" },
    { "slug": "celtic-nard", "label": "nardi celtici", "language": "la" },
    { "slug": "cassia", "label": "casiae", "language": "la" },
    { "slug": "sphagnum-hypnum", "label": "sphagni siue hypni", "language": "la" },
    { "slug": "amomum", "label": "amomi", "language": "la" },
    { "slug": "spikenard", "label": "spicae nardi", "language": "la" },
    { "slug": "dried-roses", "label": "rosarum siccarum", "language": "la" },
    { "slug": "sweet-rush-flower", "label": "floris iunci odorati", "language": "la" },
    { "slug": "pine-nuts", "label": "nucum pinearum", "language": "la" },
    { "slug": "phyllon", "label": "phyllorum", "language": "la" },
    { "slug": "figs", "label": "caricarum", "language": "la" },
    { "slug": "raisins-fat", "label": "uvarum passarum pinguium", "language": "la" },
    { "slug": "terebinth-resin", "label": "terebinthinae", "language": "la" },
    { "slug": "chian-resin", "label": "Chiaeque", "language": "la" },
    { "slug": "date-pulp", "label": "palmularum pinguium carunculae", "language": "la" },
    { "slug": "honey", "label": "mellis", "language": "la" },
    { "slug": "wine", "label": "vini", "language": "la" }
  ],
  "aliases": [
    { "ingredient_slug": "aspalathos", "variant_label": "aspalathus", "language": "en" },
    { "ingredient_slug": "bdellium", "variant_label": "bdellium", "language": "en" },
    { "ingredient_slug": "elecampane", "variant_label": "elecampane", "language": "en" },
    { "ingredient_slug": "ladanum", "variant_label": "ladanum", "language": "en" },
    { "ingredient_slug": "storax", "variant_label": "storax", "language": "en" },
    { "ingredient_slug": "myrrh", "variant_label": "myrrh", "language": "en" },
    { "ingredient_slug": "juniper-berries", "variant_label": "juniper berries", "language": "en" },
    { "ingredient_slug": "royal-reed-extract", "variant_label": "extract of the royal reed", "language": "en" },
    { "ingredient_slug": "savin", "variant_label": "savin", "language": "en" },
    { "ingredient_slug": "saffron", "variant_label": "saffron", "language": "en" },
    { "ingredient_slug": "costus", "variant_label": "costus", "language": "en" },
    { "ingredient_slug": "cardamom", "variant_label": "cardamom", "language": "en" },
    { "ingredient_slug": "cyperus", "variant_label": "cyperus", "language": "en" },
    { "ingredient_slug": "cypress-seed", "variant_label": "cypress seed", "language": "en" },
    { "ingredient_slug": "celtic-nard", "variant_label": "Celtic nard", "language": "en" },
    { "ingredient_slug": "cassia", "variant_label": "cassia", "language": "en" },
    { "ingredient_slug": "sphagnum-hypnum", "variant_label": "sphagnum or hypnum (moss)", "language": "en" },
    { "ingredient_slug": "amomum", "variant_label": "amomum", "language": "en" },
    { "ingredient_slug": "spikenard", "variant_label": "spikenard", "language": "en" },
    { "ingredient_slug": "dried-roses", "variant_label": "dried roses", "language": "en" },
    { "ingredient_slug": "sweet-rush-flower", "variant_label": "sweet rush flower", "language": "en" },
    { "ingredient_slug": "pine-nuts", "variant_label": "pine nuts", "language": "en" },
    { "ingredient_slug": "phyllon", "variant_label": "phyllon", "language": "en" },
    { "ingredient_slug": "figs", "variant_label": "figs", "language": "en" },
    { "ingredient_slug": "raisins-fat", "variant_label": "fat raisins", "language": "en" },
    { "ingredient_slug": "terebinth-resin", "variant_label": "terebinth resin", "language": "en" },
    { "ingredient_slug": "chian-resin", "variant_label": "Chian resin", "language": "en" },
    { "ingredient_slug": "date-pulp", "variant_label": "date pulp", "language": "en" },
    { "ingredient_slug": "honey", "variant_label": "honey", "language": "en" },
    { "ingredient_slug": "wine", "variant_label": "wine", "language": "en" }
  ],
  "entries": [
    { "recipe_slug": "aetius-kyphi-28", "ingredient_slug": "aspalathos", "amount_raw": "7 drachmas", "amount_value": 7, "amount_unit": "drachma" },
    { "recipe_slug": "aetius-kyphi-28", "ingredient_slug": "bdellium", "amount_raw": "7 drachmas", "amount_value": 7, "amount_unit": "drachma" },
    { "recipe_slug": "aetius-kyphi-28", "ingredient_slug": "elecampane", "amount_raw": "7 drachmas", "amount_value": 7, "amount_unit": "drachma" },
    { "recipe_slug": "aetius-kyphi-28", "ingredient_slug": "ladanum", "amount_raw": "7 drachmas", "amount_value": 7, "amount_unit": "drachma" },
    { "recipe_slug": "aetius-kyphi-28", "ingredient_slug": "storax", "amount_raw": "7 drachmas", "amount_value": 7, "amount_unit": "drachma" },
    { "recipe_slug": "aetius-kyphi-28", "ingredient_slug": "myrrh", "amount_raw": "7 drachmas", "amount_value": 7, "amount_unit": "drachma" },

    { "recipe_slug": "aetius-kyphi-28", "ingredient_slug": "juniper-berries", "amount_raw": "50 large + 50 small (count)", "amount_value": 100, "amount_unit": "count", "notes": "50 large and 50 small berries" },

    { "recipe_slug": "aetius-kyphi-28", "ingredient_slug": "royal-reed-extract", "amount_raw": "one third", "amount_value": null, "amount_unit": null },
    { "recipe_slug": "aetius-kyphi-28", "ingredient_slug": "savin", "amount_raw": "one third", "amount_value": null, "amount_unit": null },
    { "recipe_slug": "aetius-kyphi-28", "ingredient_slug": "saffron", "amount_raw": "one sixth", "amount_value": null, "amount_unit": null },
    { "recipe_slug": "aetius-kyphi-28", "ingredient_slug": "costus", "amount_raw": "one sixth", "amount_value": null, "amount_unit": null },
    { "recipe_slug": "aetius-kyphi-28", "ingredient_slug": "cardamom", "amount_raw": "five twelfths", "amount_value": null, "amount_unit": null },
    { "recipe_slug": "aetius-kyphi-28", "ingredient_slug": "cyperus", "amount_raw": "five twelfths", "amount_value": null, "amount_unit": null },
    { "recipe_slug": "aetius-kyphi-28", "ingredient_slug": "cypress-seed", "amount_raw": "one quarter", "amount_value": null, "amount_unit": null },
    { "recipe_slug": "aetius-kyphi-28", "ingredient_slug": "celtic-nard", "amount_raw": "one tenth", "amount_value": null, "amount_unit": null },

    { "recipe_slug": "aetius-kyphi-28", "ingredient_slug": "cassia", "amount_raw": "one sixth (optional)", "amount_value": null, "amount_unit": null, "notes": "optional (some)" },
    { "recipe_slug": "aetius-kyphi-28", "ingredient_slug": "sphagnum-hypnum", "amount_raw": "five twelfths (optional)", "amount_value": null, "amount_unit": null, "notes": "optional (some)" },
    { "recipe_slug": "aetius-kyphi-28", "ingredient_slug": "amomum", "amount_raw": "one sixth (optional)", "amount_value": null, "amount_unit": null, "notes": "optional (some)" },
    { "recipe_slug": "aetius-kyphi-28", "ingredient_slug": "spikenard", "amount_raw": "one sixth (optional)", "amount_value": null, "amount_unit": null, "notes": "optional (some)" },
    { "recipe_slug": "aetius-kyphi-28", "ingredient_slug": "dried-roses", "amount_raw": "one quarter (optional)", "amount_value": null, "amount_unit": null, "notes": "optional (some)" },
    { "recipe_slug": "aetius-kyphi-28", "ingredient_slug": "sweet-rush-flower", "amount_raw": "one sixth (optional)", "amount_value": null, "amount_unit": null, "notes": "optional (some)" },
    { "recipe_slug": "aetius-kyphi-28", "ingredient_slug": "pine-nuts", "amount_raw": "one quarter (optional)", "amount_value": null, "amount_unit": null, "notes": "optional (some)" },
    { "recipe_slug": "aetius-kyphi-28", "ingredient_slug": "phyllon", "amount_raw": "one quarter (optional)", "amount_value": null, "amount_unit": null, "notes": "optional (some)" },

    { "recipe_slug": "aetius-kyphi-28", "ingredient_slug": "figs", "amount_raw": "2 pounds", "amount_value": 2, "amount_unit": "pound" },
    { "recipe_slug": "aetius-kyphi-28", "ingredient_slug": "raisins-fat", "amount_raw": "one sixth", "amount_value": null, "amount_unit": null },
    { "recipe_slug": "aetius-kyphi-28", "ingredient_slug": "terebinth-resin", "amount_raw": "1 pound", "amount_value": 1, "amount_unit": "pound" },
    { "recipe_slug": "aetius-kyphi-28", "ingredient_slug": "chian-resin", "amount_raw": "1 pound", "amount_value": 1, "amount_unit": "pound" },
    { "recipe_slug": "aetius-kyphi-28", "ingredient_slug": "date-pulp", "amount_raw": "1 pound", "amount_value": 1, "amount_unit": "pound" },
    { "recipe_slug": "aetius-kyphi-28", "ingredient_slug": "honey", "amount_raw": "5 pounds", "amount_value": 5, "amount_unit": "pound" },
    { "recipe_slug": "aetius-kyphi-28", "ingredient_slug": "wine", "amount_raw": "2 pints (sextarii)", "amount_value": 2, "amount_unit": "pint" }
  ]
}

