{
  "recipes": [
    {
      "slug": "oribasius-lunar-kyphi",
      "label": "Oribasius, Syn. Eust., Lunar Kyphi (25 ingredients)",
      "language": "grc",
      "source": "Orib. Syn. 3.220"
    }
  ],
 "ingredients": [
    { "slug": "bdellium", "label": "Βδέλλιον", "language": "grc" },
    { "slug": "elecampane", "label": "ἑλένιον", "language": "grc" },
    { "slug": "schoinos-flower", "label": "σχίνου ἄνθος", "language": "grc" },
    { "slug": "sphagnon-moss", "label": "σφάγνον", "language": "grc" },
    { "slug": "juniper-berries", "label": "ἀρκευθίς", "language": "grc" },
    { "slug": "aspalathos", "label": "ἀσπάλαθος", "language": "grc" },
    { "slug": "cardamom", "label": "καρδάμωμον", "language": "grc" },
    { "slug": "cassia-tubes", "label": "κασίας σῦριγξ", "language": "grc" },
    { "slug": "spikenard", "label": "νάρδου στάχυς", "language": "grc" },
    { "slug": "cyperus", "label": "κύπερος", "language": "grc" },
    { "slug": "asphodel-root", "label": "ἀσφοδέλου ῥίζα", "language": "grc" },
    { "slug": "cypress-seed", "label": "κυπαρίσσου σπέρμα", "language": "grc" },
    { "slug": "brathyos", "label": "βράθυον", "language": "grc" },
    { "slug": "celtic-nard", "label": "νάρδος Κελτική", "language": "grc" },
    { "slug": "costus", "label": "κόστος", "language": "grc" },
    { "slug": "myrrh", "label": "σμύρνα", "language": "grc" },
    { "slug": "figs-rich", "label": "ἰσχάς λιπαρά", "language": "grc" },
    { "slug": "raisins-deseeded", "label": "σταφίς ἐκγιγαρτισμένη", "language": "grc" },
    { "slug": "pinecones", "label": "στροβίλιον", "language": "grc" },
    { "slug": "terebinth-resin", "label": "τερέβινθος", "language": "grc" },
    { "slug": "roses-dried", "label": "ῥόδον ξηρόν", "language": "grc" },
    { "slug": "storax", "label": "στύραξ", "language": "grc" },
    { "slug": "dates-rich", "label": "φοινίξ λιπαρός", "language": "grc" },
    { "slug": "honey", "label": "μέλι", "language": "grc" },
    { "slug": "wine-fragrant", "label": "οἶνος εὐώδης", "language": "grc" }
],
  "aliases": [
    { "ingredient_slug": "bdellium", "variant_label": "bdellium", "language": "en" },
    { "ingredient_slug": "elecampane", "variant_label": "elecampane", "language": "en" },
    { "ingredient_slug": "schinos-flower", "variant_label": "flower of schinos", "language": "en" },
    { "ingredient_slug": "sphagnon-moss", "variant_label": "sphagnon moss", "language": "en" },
    { "ingredient_slug": "juniper-berries", "variant_label": "juniper berries (small)", "language": "en" },
    { "ingredient_slug": "aspalathos", "variant_label": "aspalathos", "language": "en" },
    { "ingredient_slug": "cardamom", "variant_label": "cardamom", "language": "en" },
    { "ingredient_slug": "cassia-tubes", "variant_label": "cassia (in tubes)", "language": "en" },
    { "ingredient_slug": "spikenard", "variant_label": "spikenard", "language": "en" },
    { "ingredient_slug": "cyperus", "variant_label": "cyperus", "language": "en" },
    { "ingredient_slug": "asphodel-root", "variant_label": "asphodel root", "language": "en" },
    { "ingredient_slug": "cypress-seed", "variant_label": "seed of cypress", "language": "en" },
    { "ingredient_slug": "brathyos", "variant_label": "brathyos", "language": "en" },
    { "ingredient_slug": "celtic-nard", "variant_label": "Celtic nard", "language": "en" },
    { "ingredient_slug": "costus", "variant_label": "costus", "language": "en" },
    { "ingredient_slug": "myrrh", "variant_label": "myrrh", "language": "en" },
    { "ingredient_slug": "figs-rich", "variant_label": "rich figs", "language": "en" },
    { "ingredient_slug": "raisins-deseeded", "variant_label": "deseeded raisins", "language": "en" },
    { "ingredient_slug": "pinecones", "variant_label": "pinecones", "language": "en" },
    { "ingredient_slug": "terebinth-resin", "variant_label": "terebinth resin", "language": "en" },
    { "ingredient_slug": "roses-dried", "variant_label": "dried roses", "language": "en" },
    { "ingredient_slug": "storax", "variant_label": "storax", "language": "en" },
    { "ingredient_slug": "dates-rich", "variant_label": "rich dates", "language": "en" },
    { "ingredient_slug": "honey", "variant_label": "honey", "language": "en" },
    { "ingredient_slug": "wine-fragrant", "variant_label": "fragrant wine", "language": "en" }
  ],
  "entries": [
    { "recipe_slug": "oribasius-lunar-kyphi", "ingredient_slug": "bdellium", "amount_raw": "7 oz.", "amount_value": 7, "amount_unit": "oz", "source_citation": "Oribasius Syn. Eust. 3.220.t.1" },
    { "recipe_slug": "oribasius-lunar-kyphi", "ingredient_slug": "elecampane", "amount_raw": "7 oz.", "amount_value": 7, "amount_unit": "oz", "source_citation": "Oribasius Syn. Eust. 3.220.t.1" },
    { "recipe_slug": "oribasius-lunar-kyphi", "ingredient_slug": "schoinos-flower", "amount_raw": "2 oz.", "amount_value": 2, "amount_unit": "oz", "source_citation": "Oribasius Syn. Eust. 3.220.t.1" },
    { "recipe_slug": "oribasius-lunar-kyphi", "ingredient_slug": "sphagnon-moss", "amount_raw": "5 oz.", "amount_value": 5, "amount_unit": "oz", "source_citation": "Oribasius Syn. Eust. 3.220.t.1" },
    { "recipe_slug": "oribasius-lunar-kyphi", "ingredient_slug": "juniper-berries", "amount_raw": "50 units", "amount_value": 50, "amount_unit": "units", "notes": "small berries", "source_citation": "Oribasius Syn. Eust. 3.220.t.1" },
    { "recipe_slug": "oribasius-lunar-kyphi", "ingredient_slug": "aspalathos", "amount_raw": "1 pound", "amount_value": 1, "amount_unit": "pound", "source_citation": "Oribasius Syn. Eust. 3.220.t.1" },
    { "recipe_slug": "oribasius-lunar-kyphi", "ingredient_slug": "cardamom", "amount_raw": "5 oz.", "amount_value": 5, "amount_unit": "oz", "source_citation": "Oribasius Syn. Eust. 3.220.t.1" },
    { "recipe_slug": "oribasius-lunar-kyphi", "ingredient_slug": "cassia-tubes", "amount_raw": "5 oz.", "amount_value": 5, "amount_unit": "oz", "notes": "in tubes", "source_citation": "Oribasius Syn. Eust. 3.220.t.1" },
    { "recipe_slug": "oribasius-lunar-kyphi", "ingredient_slug": "spikenard", "amount_raw": "2 oz.", "amount_value": 2, "amount_unit": "oz", "source_citation": "Oribasius Syn. Eust. 3.220.t.1" },
    { "recipe_slug": "oribasius-lunar-kyphi", "ingredient_slug": "cyperus", "amount_raw": "9 oz.", "amount_value": 9, "amount_unit": "oz", "source_citation": "Oribasius Syn. Eust. 3.220.t.1" },
    { "recipe_slug": "oribasius-lunar-kyphi", "ingredient_slug": "asphodel-root", "amount_raw": "4 oz.", "amount_value": 4, "amount_unit": "oz", "notes": "root", "source_citation": "Oribasius Syn. Eust. 3.220.t.1" },
    { "recipe_slug": "oribasius-lunar-kyphi", "ingredient_slug": "cypress-seed", "amount_raw": "3 oz.", "amount_value": 3, "amount_unit": "oz", "notes": "seed", "source_citation": "Oribasius Syn. Eust. 3.220.t.1" },
    { "recipe_slug": "oribasius-lunar-kyphi", "ingredient_slug": "brathyos", "amount_raw": "4 oz.", "amount_value": 4, "amount_unit": "oz", "source_citation": "Oribasius Syn. Eust. 3.220.t.1" },
    { "recipe_slug": "oribasius-lunar-kyphi", "ingredient_slug": "celtic-nard", "amount_raw": "3 oz.", "amount_value": 3, "amount_unit": "oz", "source_citation": "Oribasius Syn. Eust. 3.220.t.1" },
    { "recipe_slug": "oribasius-lunar-kyphi", "ingredient_slug": "costus", "amount_raw": "2 oz.", "amount_value": 2, "amount_unit": "oz", "source_citation": "Oribasius Syn. Eust. 3.220.t.1" },
    { "recipe_slug": "oribasius-lunar-kyphi", "ingredient_slug": "myrrh", "amount_raw": "7 oz.", "amount_value": 7, "amount_unit": "oz", "source_citation": "Oribasius Syn. Eust. 3.220.t.1" },
    { "recipe_slug": "oribasius-lunar-kyphi", "ingredient_slug": "figs-rich", "amount_raw": "2 pints", "amount_value": 2, "amount_unit": "pint", "notes": "rich", "source_citation": "Oribasius Syn. Eust. 3.220.t.1" },
    { "recipe_slug": "oribasius-lunar-kyphi", "ingredient_slug": "raisins-deseeded", "amount_raw": "2 pints", "amount_value": 2, "amount_unit": "pint", "notes": "deseeded", "source_citation": "Oribasius Syn. Eust. 3.220.t.1" },
    { "recipe_slug": "oribasius-lunar-kyphi", "ingredient_slug": "pinecones", "amount_raw": "3 oz.", "amount_value": 3, "amount_unit": "oz", "source_citation": "Oribasius Syn. Eust. 3.220.t.1" },
    { "recipe_slug": "oribasius-lunar-kyphi", "ingredient_slug": "terebinth-resin", "amount_raw": "1 pint", "amount_value": 1, "amount_unit": "pint", "source_citation": "Oribasius Syn. Eust. 3.220.t.1" },
    { "recipe_slug": "oribasius-lunar-kyphi", "ingredient_slug": "roses-dried", "amount_raw": "3 oz.", "amount_value": 3, "amount_unit": "oz", "notes": "dried", "source_citation": "Oribasius Syn. Eust. 3.220.t.1" },
    { "recipe_slug": "oribasius-lunar-kyphi", "ingredient_slug": "storax", "amount_raw": "7 oz.", "amount_value": 7, "amount_unit": "oz", "source_citation": "Oribasius Syn. Eust. 3.220.t.1" },
    { "recipe_slug": "oribasius-lunar-kyphi", "ingredient_slug": "dates-rich", "amount_raw": "1 pint", "amount_value": 1, "amount_unit": "pint", "notes": "rich", "source_citation": "Oribasius Syn. Eust. 3.220.t.1" },
    { "recipe_slug": "oribasius-lunar-kyphi", "ingredient_slug": "honey", "amount_raw": "5 pints", "amount_value": 5, "amount_unit": "pint", "source_citation": "Oribasius Syn. Eust. 3.220.t.1" },
    { "recipe_slug": "oribasius-lunar-kyphi", "ingredient_slug": "wine-fragrant", "amount_raw": "to sufficiency (fragrant wine)", "amount_value": null, "amount_unit": null, "notes": "as much as suffices", "source_citation": "Oribasius Syn. Eust. 3.220.t.1" }
  ]
}

