{
  "recipes": [{
    "slug": "test-recipe",
    "label": "Test Recipe", 
    "language": "en"
  }],
  "ingredients": [{
    "slug": "salt",
    "label": "Salt",
    "language": "en"
  }],
  "aliases": [],
  "entries": [{
    "recipe_slug": "test-recipe",
    "ingredient_slug": "salt",
    "amount_raw": "1 tsp"
  }]
}
